<?xml version="1.0" encoding="UTF-8"?>
<data xmlns="http://city-tour-operator.org/cto"
	xmlns:xsi="http://www.w3.org/2001/XMLSchema-instance"
	xsi:schemaLocation="http://city-tour-operator.org/cto ../../schema/schema.xsd">

	<!-- ======================= TOUR 1 ======================= -->
	<tours>
		<tour>
			<tour_name>Loire Valley Castles Ride</tour_name>
			<company>
				<name>Cycle France Adventures</name>
				<contact>
					<email>info@cyclefrance.com</email>
					<phone_number>+33 1 23 45 67 89</phone_number>
				</contact>
				<address>
					<street>12 Rue de la Loire</street>
					<city>Tours</city>
					<code>37000</code>
					<country>France</country>
				</address>
			</company>
			<short_description>Explore the famous castles of the Loire Valley by bike.</short_description>
			<long_description>This moderate cycling tour takes you through the heart of the Loire Valley, visiting
				châteaux, vineyards, and picturesque villages.</long_description>
			<category>moderate</category>
			<distance>150.5</distance>
			<duration>
				<duration_days>5</duration_days>
				<start_date>2027-05-10</start_date>
				<end_date>2027-05-15</end_date>
			</duration>
			<price>
				<amount>850.00</amount>
				<currency>EUR</currency>
			</price>
			<guide idref="g1" />
			<tour_availability>
				<capacity>20</capacity>
				<current_number_of_participants>12</current_number_of_participants>
				<availability>open</availability>
			</tour_availability>
			<starting_point>
				<coordinates>
					<longitude>0.6889</longitude>
					<latitude>47.3941</latitude>
				</coordinates>
				<address>
					<street>Place Jean Jaurès</street>
					<city>Tours</city>
					<code>37000</code>
					<country>France</country>
				</address>
			</starting_point>
			<final_destination>
				<coordinates>
					<longitude>1.5167</longitude>
					<latitude>47.5833</latitude>
				</coordinates>
				<address>
					<street>Rue Royale</street>
					<city>Blois</city>
					<code>41000</code>
					<country>France</country>
				</address>
			</final_destination>
			<bikes>
				<bike id="bikeF1">
					<model>Trek FX 3</model>
					<bike_type>
						<type>hybrid</type>
					</bike_type>
					<gear_count>21</gear_count>
					<size>M</size>
					<weight>13.5</weight>
					<rental_price_per_day>
						<amount>25.00</amount>
						<currency>EUR</currency>
					</rental_price_per_day>
					<availability>available</availability>
				</bike>
			</bikes>
		</tour>
		<!-- ======================= TOUR 2 ======================= -->
		<tour>
			<tour_name>Tuscany Wine Hills</tour_name>
			<company>
				<name>Italia Bike Tours</name>
				<contact>
					<email>contact@italiabike.it</email>
					<phone_number>+39 055 678901</phone_number>
				</contact>
				<address>
					<street>Via Roma 22</street>
					<city>Florence</city>
					<code>50123</code>
					<country>Italy</country>
				</address>
			</company>
			<short_description>Cycle through Tuscany's rolling hills and vineyards.</short_description>
			<long_description>This scenic route offers challenging climbs, breathtaking views, and authentic Italian
				cuisine experiences along the way.</long_description>
			<category>challenging</category>
			<distance>210.0</distance>
			<duration>
				<duration_days>7</duration_days>
				<start_date>2027-06-01</start_date>
				<end_date>2027-06-07</end_date>
			</duration>
			<price>
				<amount>1250.00</amount>
				<currency>EUR</currency>
			</price>
			<guide idref="g2" />
			<tour_availability>
				<capacity>15</capacity>
				<current_number_of_participants>10</current_number_of_participants>
				<availability>limited</availability>
			</tour_availability>
			<starting_point>
				<coordinates>
					<longitude>11.2558</longitude>
					<latitude>43.7696</latitude>
				</coordinates>
				<address>
					<street>Piazza della Repubblica</street>
					<city>Florence</city>
					<code>50123</code>
					<country>Italy</country>
				</address>
			</starting_point>
			<final_destination>
				<coordinates>
					<longitude>11.3307</longitude>
					<latitude>43.3188</latitude>
				</coordinates>
				<address>
					<street>Via di Fontebranda</street>
					<city>Siena</city>
					<code>53100</code>
					<country>Italy</country>
				</address>
			</final_destination>
			<bikes>
				<bike id="bikeI1">
					<model>Specialized Allez</model>
					<bike_type>
						<type>road</type>
					</bike_type>
					<gear_count>22</gear_count>
					<size>L</size>
					<weight>9.5</weight>
					<rental_price_per_day>
						<amount>30.00</amount>
						<currency>EUR</currency>
					</rental_price_per_day>
					<availability>available</availability>
				</bike>
			</bikes>
		</tour>
		<!-- ======================= TOUR 3 ======================= -->
		<tour>
			<tour_name>Coastal Catalonia Ride</tour_name>
			<company>
				<name>Cycling Spain Co.</name>
				<contact>
					<email>info@cyclingspain.es</email>
					<phone_number>+34 933 224 567</phone_number>
				</contact>
				<address>
					<street>Gran Via de les Corts Catalanes 112</street>
					<city>Barcelona</city>
					<code>08010</code>
					<country>Spain</country>
				</address>
			</company>
			<short_description>Enjoy the Mediterranean coast from Barcelona to Girona.</short_description>
			<long_description>A relaxed coastal tour with daily swims, seaside meals, and cultural stops in small
				Catalan towns.</long_description>
			<category>easy</category>
			<distance>130.0</distance>
			<duration>
				<duration_days>4</duration_days>
				<start_date>2027-09-03</start_date>
				<end_date>2027-09-07</end_date>
			</duration>
			<price>
				<amount>650.00</amount>
				<currency>EUR</currency>
			</price>
			<guide idref="g3" />
			<tour_availability>
				<capacity>25</capacity>
				<current_number_of_participants>18</current_number_of_participants>
				<availability>open</availability>
			</tour_availability>
			<starting_point>
				<coordinates>
					<longitude>2.1734</longitude>
					<latitude>41.3851</latitude>
				</coordinates>
				<address>
					<street>Plaza Catalunya</street>
					<city>Barcelona</city>
					<code>08002</code>
					<country>Spain</country>
				</address>
			</starting_point>
			<final_destination>
				<coordinates>
					<longitude>2.8196</longitude>
					<latitude>41.9794</latitude>
				</coordinates>
				<address>
					<street>Carrer de la Força</street>
					<city>Girona</city>
					<code>17004</code>
					<country>Spain</country>
				</address>
			</final_destination>
			<bikes>
				<bike id="bikeS1">
					<model>Giant Escape 2</model>
					<bike_type>
						<type>city</type>
					</bike_type>
					<gear_count>18</gear_count>
					<size>M</size>
					<weight>14.0</weight>
					<rental_price_per_day>
						<amount>20.00</amount>
						<currency>EUR</currency>
					</rental_price_per_day>
					<availability>available</availability>
				</bike>
			</bikes>
		</tour>
		<!-- ======================= TOUR 4 ======================= -->
		<tour>
			<tour_name>Swiss Alpine Challenge</tour_name>
			<company>
				<name>Alpine Cycle Expeditions</name>
				<contact>
					<email>info@alpinecycle.ch</email>
					<phone_number>+41 44 567 8900</phone_number>
				</contact>
				<address>
					<street>Bahnstrasse 15</street>
					<city>Zurich</city>
					<code>8001</code>
					<country>Switzerland</country>
				</address>
			</company>
			<short_description>Conquer the mountain passes of the Swiss Alps.</short_description>
			<long_description>This demanding tour features iconic climbs such as Grimsel and Furka passes, ideal for
				experienced cyclists seeking a true alpine challenge.</long_description>
			<category>challenging</category>
			<distance>320.0</distance>
			<duration>
				<duration_days>8</duration_days>
				<start_date>2027-07-12</start_date>
				<end_date>2027-07-20</end_date>
			</duration>
			<price>
				<amount>1850.00</amount>
				<currency>CHF</currency>
			</price>
			<guide idref="g4" />
			<tour_availability>
				<capacity>12</capacity>
				<current_number_of_participants>9</current_number_of_participants>
				<availability>limited</availability>
			</tour_availability>
			<starting_point>
				<coordinates>
					<longitude>8.5417</longitude>
					<latitude>47.3769</latitude>
				</coordinates>
				<address>
					<street>Bahnhofstrasse 10</street>
					<city>Zurich</city>
					<code>8001</code>
					<country>Switzerland</country>
				</address>
			</starting_point>
			<final_destination>
				<coordinates>
					<longitude>8.3059</longitude>
					<latitude>46.9470</latitude>
				</coordinates>
				<address>
					<street>Bundesplatz</street>
					<city>Bern</city>
					<code>3001</code>
					<country>Switzerland</country>
				</address>
			</final_destination>
			<bikes>
				<bike id="bikeCH1">
					<model>Cannondale Synapse Carbon</model>
					<bike_type>
						<type>road</type>
					</bike_type>
					<gear_count>22</gear_count>
					<size>M</size>
					<weight>8.8</weight>
					<rental_price_per_day>
						<amount>40.00</amount>
						<currency>CHF</currency>
					</rental_price_per_day>
					<availability>available</availability>
				</bike>
			</bikes>
		</tour>
		<!-- ======================= TOUR 5 ======================= -->
		<tour>
			<tour_name>Danube River Path</tour_name>
			<company>
				<name>EuroCycle Adventures</name>
				<contact>
					<email>info@eurocycle.at</email>
					<phone_number>+43 1 234 5678</phone_number>
				</contact>
				<address>
					<street>Ringstrasse 50</street>
					<city>Vienna</city>
					<code>1010</code>
					<country>Austria</country>
				</address>
			</company>
			<short_description>Ride along the scenic Danube River from Vienna to Budapest.</short_description>
			<long_description>A classic European route following the Danube through picturesque villages, castles, and
				nature reserves with flat terrain perfect for all levels.</long_description>
			<category>easy</category>
			<distance>290.0</distance>
			<duration>
				<duration_days>6</duration_days>